{
  "$schema": "https://json-schema.org/draft/2020-12/schema",
  "type": "object",
  "required": [
    "project",
    "task",
    "release",
    "source_commit",
    "selected_sources",
    "rib_thickness_mm",
    "angles_deg",
    "core_z_mm",
    "outer_r_mm",
    "outer_body_start_r_mm",
    "A",
    "B",
    "C",
    "proposed_slot_width_mm",
    "proposed_slot_corner_radius_mm",
    "radial_stroke_mm",
    "vertical_stroke_mm",
    "disk_start_bottom_z_mm",
    "retention_trial_radial_mm",
    "retention_trial_vertical_mm",
    "screening_min_neck_mm",
    "sheet_hw_mm",
    "sheet_margin_mm",
    "raster_dpi",
    "epsilon_mm3",
    "measured_thickness_mm",
    "measured_kerf_mm",
    "adhesive_specification",
    "grain_hypothesis",
    "relevant_interfaces",
    "polygon_fillet_chord_tolerance_mm"
  ],
  "additionalProperties": false,
  "properties": {
    "project": {
      "const": "CTB-01"
    },
    "task": {
      "const": "CTB-005"
    },
    "release": {
      "const": "DESIGN_ONLY"
    },
    "source_commit": {
      "const": "6292a0e22c9aacade5aa7c7995332494aa8de005"
    },
    "selected_sources": {
      "const": [
        "SOFT_CURVE",
        "B_THROUGH_ADHESIVE",
        "A_COMPACT_CLOSED",
        "Y_FIRST",
        "A_RIM_OPEN",
        "NO_HOLE"
      ]
    },
    "rib_thickness_mm": {
      "const": 6
    },
    "angles_deg": {
      "const": [
        0,
        60,
        120,
        180,
        240,
        300
      ]
    },
    "core_z_mm": {
      "const": [
        456,
        494
      ]
    },
    "outer_r_mm": {
      "const": 169
    },
    "outer_body_start_r_mm": {
      "const": 96
    },
    "A": {
      "const": {
        "inner_r_mm": 81,
        "outer_radius_mm": 1,
        "relief_rz_mm": [
          79,
          479.6,
          83.2,
          486.4
        ],
        "relief_radius_mm": 0.8
      }
    },
    "B": {
      "const": {
        "rail_r_mm": [
          82,
          88
        ],
        "bridge_z_mm": [
          465,
          475
        ],
        "bridge_end_r_mm": 98,
        "corner_radius_mm": 0.8,
        "proposed_slots_r_mm": {
          "P04L": [
            81.3,
            88.7
          ],
          "P04U": [
            81.8,
            88.2
          ]
        }
      }
    },
    "C": {
      "const": {
        "rail_r_mm": [
          82,
          88
        ],
        "rail_top_z_mm": 466,
        "head_bottom_z_mm": 465,
        "head_step_z_mm": 479.6,
        "upper_head_inner_r_mm": 83.2,
        "corner_radius_mm": 0.4,
        "proposed_slots_r_mm": {
          "P04L": [
            81.8,
            88.2
          ]
        }
      }
    },
    "proposed_slot_width_mm": {
      "const": 6.4
    },
    "proposed_slot_corner_radius_mm": {
      "const": 0.2
    },
    "radial_stroke_mm": {
      "const": 100
    },
    "vertical_stroke_mm": {
      "const": 64
    },
    "disk_start_bottom_z_mm": {
      "const": 520
    },
    "retention_trial_radial_mm": {
      "const": 20
    },
    "retention_trial_vertical_mm": {
      "const": 6.4
    },
    "screening_min_neck_mm": {
      "const": 6
    },
    "sheet_hw_mm": {
      "const": [
        800,
        440
      ]
    },
    "sheet_margin_mm": {
      "const": 10
    },
    "raster_dpi": {
      "const": 96
    },
    "epsilon_mm3": {
      "const": 1e-06
    },
    "measured_thickness_mm": {
      "const": null
    },
    "measured_kerf_mm": {
      "const": null
    },
    "adhesive_specification": {
      "const": null
    },
    "grain_hypothesis": {
      "const": "face grain parallel to local r; not tested strength"
    },
    "relevant_interfaces": {
      "const": [
        "IF-06",
        "IF-07",
        "IF-08",
        "IF-12",
        "IF-13"
      ]
    },
    "polygon_fillet_chord_tolerance_mm": {
      "const": 0.002
    }
  }
}
